{
  "$schema": "https://json-schema.org/draft/2020-12/schema",
  "$id": "https://htdt.example/schemas/capture-bundle-v1/timing.schema.json",
  "title": "HTDT Capture Timing v1",
  "type": "object",
  "additionalProperties": false,
  "required": [
    "schema",
    "schema_version",
    "clock_domain",
    "correlations"
  ],
  "properties": {
    "schema": {
      "const": "htdt.capture.timing"
    },
    "schema_version": {
      "const": "1.0.0"
    },
    "clock_domain": {
      "type": "string",
      "minLength": 1
    },
    "correlations": {
      "type": "array",
      "minItems": 1,
      "items": {
        "type": "object",
        "additionalProperties": false,
        "required": [
          "monotonic_s",
          "utc",
          "method"
        ],
        "properties": {
          "monotonic_s": {
            "type": "number"
          },
          "utc": {
            "type": "string",
            "format": "date-time"
          },
          "method": {
            "type": "string",
            "minLength": 1
          },
          "estimated_uncertainty_s": {
            "type": [
              "number",
              "null"
            ],
            "minimum": 0
          }
        }
      }
    }
  }
}
